{
  "scenario_id": "EVAL-HARNESS-GRAPH-001",
  "sources_consulted": [
    "docs/contexto/roteador.md",
    "docs/contexto/README.md",
    "docs/acompanhamento/roadmap.md",
    "docs/acompanhamento/realizacoes.md"
  ],
  "evidence_metadata": {
    "context_id": "CTX-EVD-HARNESS-001",
    "context_type": "evidence",
    "status_after_collection": "registrado",
    "required_relations": ["governed_by CTX-GOV-001", "informs WORK-018"]
  },
  "work_transition": {"remove_from_roadmap": true, "add_to_outcomes": true, "allow_duplicate": false},
  "references_to_update": ["dependência de WORK-018", "condições de encerramento de WORK-011 e WORK-012"],
  "validations": ["scripts/validar-documentacao.sh", "scripts/validar-contexto.sh"],
  "risks_to_preserve": ["não aceitar decisões candidatas por efeito da avaliação"],
  "meta_pdca": {"failure_found": false, "result": "nenhuma falha do artefato foi encontrada"},
  "next_step": "migrar WORK-017 após aprovação da baseline"
}
